{
  "version": "1.0",
  "name": "DVLA Drivers Medical Service",
  "exportedAt": "2026-04-05T00:00:00.000Z",
  "nodes": [
    {
      "id": "dm1",
      "type": "interface",
      "position": { "x": 340, "y": 595 },
      "data": {
        "title": "GOV.UK Medical Notification",
        "description": "Online self-declaration service on GOV.UK allowing drivers to notify DVLA of a medical condition, disability, or relevant change in health. Covers a wide range of conditions via structured digital forms.",
        "nodeType": "interface",
        "owner": "DVLA Digital Services",
        "organisation": "DVLA",
        "tags": ["citizen-facing", "digital", "self-declaration"],
        "status": "active",
        "confidenceScore": 0.9,
        "notes": "Introduced as part of DVLA's digital transformation. Not all conditions can be notified online; some require paper forms. Does not cover vocational licence medical declarations.",
        "automationLevel": 0.35,
        "criticalityLevel": 0.3,
        "overlays": { "frictionPoints": true },
        "riskFlags": [],
        "opportunities": [],
        "selected": false
      },
      "draggable": true
    },
    {
      "id": "dm2",
      "type": "interface",
      "position": { "x": -20, "y": 370 },
      "data": {
        "title": "Condition-Specific Medical Questionnaire",
        "description": "Paper or PDF questionnaires sent to drivers to gather information about their medical condition. Condition-specific forms exist for epilepsy, diabetes, heart conditions, visual disorders, sleep disorders, and many others. Driver returns completed form to DVLA Swansea.",
        "nodeType": "interface",
        "owner": "Drivers Medical Group",
        "organisation": "DVLA",
        "tags": ["paper", "citizen-facing", "questionnaire"],
        "status": "active",
        "confidenceScore": 0.85,
        "notes": "Many questionnaires remain paper-based. Drivers sometimes fail to return them, causing delays. DVLA can revoke a licence for non-response. Digital versions of some forms exist but coverage is partial.",
        "automationLevel": 0.05,
        "criticalityLevel": 0.55,
        "overlays": { "frictionPoints": true },
        "riskFlags": [],
        "opportunities": [],
        "selected": false
      },
      "draggable": true
    },
    {
      "id": "dm3",
      "type": "interface",
      "position": { "x": -20, "y": 190 },
      "data": {
        "title": "D4 Medical Examination Form",
        "description": "Statutory medical examination report completed by a registered medical practitioner for vocational licence (Group 2: HGV, bus, coach) applicants and renewals. Includes vision, cardiovascular, neurological, and other assessments. Higher standards apply than for Group 1 licences.",
        "nodeType": "interface",
        "owner": "Applicant's GP or DVLA-approved doctor",
        "organisation": "NHS / Private Medical",
        "tags": ["paper", "vocational", "Group-2", "cross-boundary", "medical-exam"],
        "status": "active",
        "confidenceScore": 0.9,
        "notes": "Cost of D4 exam falls on the driver (not NHS-funded). Average cost £50–£100. Some GPs refuse to complete them. Delays common when booked through private providers.",
        "automationLevel": 0.05,
        "criticalityLevel": 0.75,
        "overlays": { "orgBoundaries": true, "frictionPoints": true },
        "riskFlags": [],
        "opportunities": [],
        "selected": false
      },
      "draggable": true
    },
    {
      "id": "dm4",
      "type": "interface",
      "position": { "x": 40, "y": 307 },
      "data": {
        "title": "Third-Party Medical Notification",
        "description": "Notifications received from police (via KADOE), courts, coroners, NHS clinicians, DVSA, or other government agencies about a driver's fitness to drive. Healthcare professionals have a duty to advise patients to notify DVLA but no statutory duty to notify DVLA directly (with limited exceptions).",
        "nodeType": "interface",
        "owner": "Various (Police, NHS, Courts)",
        "organisation": "Multi-agency",
        "tags": ["third-party", "cross-boundary", "notification", "police", "NHS"],
        "status": "active",
        "confidenceScore": 0.8,
        "notes": "KADOE (Knowledge At Date Of Event) is used by police to query the driver record. Courts notify DVLA of disqualifications. NHS clinician notifications are informal and inconsistent — no structured data exchange. Notification quality varies significantly by source.",
        "automationLevel": 0.1,
        "criticalityLevel": 0.62,
        "overlays": { "orgBoundaries": true, "dataQuality": true },
        "riskFlags": [],
        "opportunities": [],
        "selected": false
      },
      "draggable": true
    },
    {
      "id": "dm5",
      "type": "interface",
      "position": { "x": 904, "y": 577 },
      "data": {
        "title": "Driver Outcome Letter",
        "description": "Formal written notification to the driver of the licensing decision: licence granted, short-period licence issued, licence refused, or licence revoked. Includes reason for decision and information about the right to appeal to a magistrates court (England and Wales) or sheriff court (Scotland).",
        "nodeType": "interface",
        "owner": "Drivers Medical Group",
        "organisation": "DVLA",
        "tags": ["citizen-facing", "notification", "decision-outcome"],
        "status": "active",
        "confidenceScore": 0.92,
        "notes": "Letters sent by post. DVLA has explored digital notifications but formal decisions still require paper. Letters sometimes criticised for lacking clarity on appeal routes and timeframes.",
        "automationLevel": 0.82,
        "criticalityLevel": 0.32,
        "overlays": {},
        "riskFlags": [],
        "opportunities": [],
        "selected": false
      },
      "draggable": true
    },
    {
      "id": "dm6",
      "type": "interface",
      "position": { "x": 100, "y": 550 },
      "data": {
        "title": "DVLA Contact Centre",
        "description": "Telephone contact centre handling driver enquiries about medical cases, form requests, and progress chasing. Drivers can call to request paper forms, check case status, and seek clarification on decisions.",
        "nodeType": "interface",
        "owner": "Customer Services",
        "organisation": "DVLA",
        "tags": ["telephone", "citizen-facing", "enquiries"],
        "status": "active",
        "confidenceScore": 0.82,
        "notes": "High call volumes are a known pressure point. Drivers are often unable to get case-specific information due to data protection restrictions. Wait times can be significant. No online case-tracking for medical cases.",
        "automationLevel": 0.15,
        "criticalityLevel": 0.35,
        "overlays": { "frictionPoints": true },
        "riskFlags": [],
        "opportunities": [],
        "selected": false
      },
      "draggable": true
    },
    {
      "id": "dm7",
      "type": "decision",
      "position": { "x": 160, "y": 280 },
      "data": {
        "title": "Initial Case Triage",
        "description": "Caseworker assessment of an incoming notification or returned questionnaire. Determines whether the case can be decided based on existing information, requires further medical evidence, or warrants referral to a DVLA Medical Adviser. Straightforward cases (e.g. single confirmed seizure with clear rules) may be decided at this stage.",
        "nodeType": "decision",
        "owner": "Drivers Medical Group",
        "organisation": "DVLA",
        "tags": ["casework", "triage", "human-judgement"],
        "status": "active",
        "confidenceScore": 0.78,
        "notes": "Caseworkers apply rules from the At a Glance guide. Complex or borderline cases escalated to Medical Advisers. Significant case backlogs reported publicly, leading to extended processing times.",
        "automationLevel": 0.2,
        "criticalityLevel": 0.65,
        "overlays": {},
        "riskFlags": [],
        "opportunities": [],
        "selected": false
      },
      "draggable": true
    },
    {
      "id": "dm8",
      "type": "decision",
      "position": { "x": -20, "y": 28 },
      "data": {
        "title": "DVLA Medical Adviser Review",
        "description": "Clinically qualified Medical Adviser (doctor employed by DVLA) reviews complex, borderline, or contested cases. Assesses whether the driver meets the medical standards for the relevant licence group. May request additional specialist reports. Decision is medical opinion that informs the licensing decision.",
        "nodeType": "decision",
        "owner": "Medical Adviser",
        "organisation": "DVLA",
        "tags": ["medical", "human-judgement", "clinical", "complex-cases"],
        "status": "active",
        "confidenceScore": 0.85,
        "notes": "DVLA Medical Advisers are registered doctors. There is reportedly a shortage of Medical Advisers, which contributes to backlogs. Their opinion is advisory but typically determines the outcome. They do not examine drivers directly.",
        "automationLevel": 0.05,
        "criticalityLevel": 0.93,
        "overlays": { "policyConstraints": true },
        "riskFlags": [],
        "opportunities": [],
        "selected": false
      },
      "draggable": true
    },
    {
      "id": "dm9",
      "type": "decision",
      "position": { "x": 136, "y": 55 },
      "data": {
        "title": "Licence Decision",
        "description": "Formal licensing decision made by DVLA on behalf of the Secretary of State for Transport. Outcomes: full licence granted; short-period licence (1, 2, or 3 years); licence refused (new applicant); licence revoked (existing holder). Based on whether driver meets medical standards set out in retained EU law and DVLA policy.",
        "nodeType": "decision",
        "owner": "Drivers Medical Group",
        "organisation": "DVLA",